{
  "schema": "zaentrum.library.version/2",
  "versionId": "a2b24ff6-1002-5571-a749-7914835fa100",
  "createdAt": "2026-09-18T09:20:00Z",
  "createdBy": "analyzer example",
  "edition": {
    "kind": "directors-cut",
    "label": "Director's Cut",
    "decidedBy": "human",
    "decidedAt": "2026-09-18T09:20:00Z",
    "evidence": [
      {
        "signal": "folder-name",
        "value": "Director's Cut"
      }
    ]
  },
  "presentation": {
    "colour": "colour",
    "dynamicRange": "sdr",
    "stereo3d": "none",
    "aspectRatio": "12:5"
  },
  "runtimeMs": 812000,
  "chapters": [],
  "chaptersFrom": null,
  "segments": [],
  "completeness": {
    "status": "complete",
    "evidence": []
  },
  "sourceIds": [
    "bce3e1b4-6dd5-5844-b8b0-70cb3007e393",
    "b01e5486-1e84-5253-adfa-7c530752390b"
  ],
  "originalFiles": [
    "original-1.mkv",
    "original-2.mkv"
  ]
}
